annotator,base_question,type1,type2,type3,answer
aditya,Winnipeg is the capital city of which Canadian province?,"What is the Canadian political division, whose chief urban center shares its name with the title of a 1962 hit song by The Spotnicks, a song that references a specific type of satellite communication?
","Nestled near the longitudinal center of the country, which prairie province's most populous urban center, named after a nearby lake and river system and known historically as a major grain exchange hub, shares its namesake with the childhood home of a prominent member of the British Royal Family, and is not Saskatchewan?
","During the centennial celebrations of the Dominion, a prairie metropolis, known for its confluence of two rivers and a prominent museum dedicated to human rights, served as the seat of government for a province. This province, bordered to the south by the Peace Garden State and once a key player in the Red River Resistance, held a significant position in the negotiations surrounding the Statute of Westminster. If the current Lieutenant Governor, who is rumored to have a penchant for collecting antique maps, were to host a gala celebrating the province's agricultural heritage, in which province's capital would this grand event most likely take place, assuming the Lieutenant Governor resides in the province they represent and not in a neighboring province famed for its wheat production?
","{'aliases': [""Manitoba's"", 'Province of Manitoba', 'Manitoba Education, Research and Learning Information Networks', 'CA-MB', 'Manitoban', 'Manitoba Education Research & Learning Information Networks', 'Manitoba', 'Manitoba, towns and cities', 'Manitoba, Canada'], 'normalized_aliases': ['manitoba canada', 'ca mb', 'manitoba education research and learning information networks', 'manitoba s', 'manitoba towns and cities', 'manitoban', 'manitoba education research learning information networks', 'manitoba', 'province of manitoba'], 'matched_wiki_entity_name': '', 'normalized_matched_wiki_entity_name': '', 'normalized_value': 'manitoba', 'type': 'WikipediaEntity', 'value': 'Manitoba'}"
aditya,What is the technical term for a solid figure with five plane (flat) faces?,"What appellation do mathematicians employ for a three-dimensional geometric construct, bounded by a quintet of coplanar polygons, each delineated by straight lines?
","Considering geometric solids, and given that the ancient Greeks explored many such shapes, is it accurate to state that the proper designation for a polyhedron possessing five planar surfaces, a concept related to but distinct from a hexagonal prism, is best described as which of the following: tetrahedron, hexahedron, or the term also associated with the U.S. military headquarters?
","During the epoch when scholars meticulously cataloged geometric forms, predating widespread computational assistance in mathematical disciplines, what nomenclature, accepted within the scientific community and specifically denoting a three-dimensional polyhedron, accurately identifies a configuration bound by precisely five coplanar polygons, bearing in mind that this term should not be confused with figures possessing six faces, which were of particular interest to Euler's contemporaries, and also acknowledging the contributions of Pythagoras to the understanding of similar, though simpler, spatial constructs?
","{'aliases': ['5-hedron', 'Pentahedron', 'Pentahedra'], 'normalized_aliases': ['pentahedron', 'pentahedra', '5 hedron'], 'matched_wiki_entity_name': '', 'normalized_matched_wiki_entity_name': '', 'normalized_value': 'pentahedron', 'type': 'WikipediaEntity', 'value': 'Pentahedron'}"
aditya,The common vocal sound produced by blocking exhaled airflow (when voicing a vowel) by suddenly closing the vocal tract is called a '(what?) stop'?,"The articulatory gesture involving complete obstruction of the breath stream within the oral cavity, typified by sounds like those made by the dental consonant of the Romance language spoken in the Iberian Peninsula, is technically referred to as a '(what?) plosive'?
","Given its prevalent use in spoken communication, what is the articulatory term for a sound where the breath stream, originating from one's vital capacity, is momentarily impeded through the complete closure of the oral passage, preceding the phonation of a vowel, similar to the obstruction observed when producing sounds like /p/, /t/, or /k/ – is it referred to as a '[phonetic feature] stop', '[manner of articulation] stop' or '[suprasegmental] stop'?
","During the epoch when the head of the French state resided in the Élysée Palace, and the official language of Quebec echoed across the St. Lawrence, what is the linguistic term for the articulatory gesture where pulmonic egressive airflow is momentarily ceased via complete occlusion within the oral cavity, resulting in a plosive consonant—a sound, let's say, akin to the initial sound in 'pat' but excluding any fricative or affricate qualities and ignoring any influence from velarization?
","{'aliases': ['Voiceless glottal stop', 'Glotal stop', '/ʔ/', 'Glottalstop', 'Laryngeal stop', 'Glottal stop', 'Glottal Stop', 'Glottal plosive', 'ʔ (IPA)', 'Glottal closure', 'ʔ', 'Laryngeal plosive', 'Voiceless glottal plosive', 'Gloʔal stop', ""Glo'all stop"", 'Glottal stops', 'Glottlestop'], 'normalized_aliases': ['voiceless glottal plosive', 'ʔ', 'glottal plosive', 'glottalstop', 'glottal stop', 'glo all stop', 'glottlestop', 'ʔ ipa', 'voiceless glottal stop', 'glotal stop', 'glottal stops', 'laryngeal plosive', 'gloʔal stop', 'glottal closure', 'laryngeal stop'], 'matched_wiki_entity_name': '', 'normalized_matched_wiki_entity_name': '', 'normalized_value': 'glottal stop', 'type': 'WikipediaEntity', 'value': 'Glottal stop'}"
aditya,In which series are FBI agents Fox Mulder (David Duchovny) and Dana Scully (Gillian Anderson) the investigators of cases involving paranormal phenomena?,"In what episodic narrative, featuring a duo – one, a male actor known for his role in ""Californication"", and the other, a female actress celebrated for her performance in ""The Crown"" – portraying federal law enforcement officers, does the storyline predominantly revolve around inquiries into occurrences that defy conventional scientific understanding?
","Considering the show's cultural impact, what cinematic narrative, featuring a pair of fictional government employees – one, a believer in the unexplained, portrayed by the son of a notable publicist, and the other, a medical doctor questioning the same, played by an actress later known for her role in a historical drama set in the British monarchy – focuses its episodic structure on inquiries into events beyond the realm of conventional science, potentially alongside investigations into conspiracies like those popularized by Allin Specter's work, and is it more or less contemporary with the original run of ""Twin Peaks""?
","During the era of cathode-ray tube dominance in home entertainment, a televised drama featured two individuals: one, an Oxford graduate with a medical degree, skeptical by nature yet bound by scientific curiosity; the other, a psychology graduate with an interest in the unexplained, fueled by a childhood trauma involving his sister. In this program, broadcast during a time when dial-up internet was the cutting edge of home connectivity and grunge music dominated the airwaves, these two individuals, one portrayed by a performer who later explored comedic roles and another who later portrayed a goddess in a fantasy series, investigated events that defied conventional explanation. Considering that this show was supposedly cancelled due to low viewership, but revived later in the 21st century, what is the name of the series where this specific pair of federal law enforcement officers, specializing in cases of extraordinary and often inexplicable occurrences, spend their days?
","{'aliases': ['Mulderites', 'X-philes', 'The X-Files Opening sequence', 'X-Files, The', 'The X-Philes', 'Opening title sequence of The X-Files', 'The X File', 'X-Phile', 'The X-files', 'X-Files (20th century fox)', 'The X-Files Awards and Nominations', 'X-Philes', 'X files tv series', 'The X Files', 'TX-F', 'T-XF', 'T-X-F', 'TXF3', 'Xfiles', 'The X-Files', 'The X Files (television series)', 'X-files', 'X files', 'The X files', 'History of The X-Files', 'X aktak', 'The X-Files opening credits', 'The X-Files fandom', 'X-Files', 'X akták', 'The x files'], 'normalized_aliases': ['mulderites', 'x aktak', 'opening title sequence of x files', 'x files awards and nominations', 'x files tv series', 'x phile', 'x files 20th century fox', 't x f', 'txf3', 'xfiles', 'x files television series', 'history of x files', 'x philes', 'x files opening credits', 'x files fandom', 'tx f', 'x file', 'x akták', 'x files opening sequence', 't xf', 'x files'], 'matched_wiki_entity_name': '', 'normalized_matched_wiki_entity_name': '', 'normalized_value': 'x files', 'type': 'WikipediaEntity', 'value': 'The X-Files'}"
aditya,Who was shot by Valery Solanas on 3 June 1968?,"On the anniversary of the end of the Six-Day War, whose alter ego, an influential figure in the world of avant-garde cinema and pop art, became the target of an attempted assassination by the author of the ""SCUM Manifesto""?
","Amidst the cultural upheaval of the late sixties, can you discern which luminary of avant-garde expression found themselves the target of an act of violence perpetrated by the S.C.U.M. Manifesto's author on the third day of June, a year divisible by eight, considering that this individual also collaborated with Nico and was a key figure in the Factory scene, unlike, say, Jack Smith or Kenneth Anger?
","On a day mirroring the third day of the sixth month in '68, amidst whispers of SCUM, the target, known for his pronouncements on understanding media, was struck. His spouse's sibling, a prominent actress at the time, was deeply affected. Who became the victim of the act perpetrated by the individual rumored to have authored ""Manifesto""? He had previously been affiliated with a publication also connected to the ""Warhol 13 most beautiful..."". Was it a contemporary of, say, Alfred Hitchcock, or someone else entirely?
","{'aliases': ['Andy Warhaul', 'Warhol', 'Warholian Pop', 'Andy Warhola', 'Andrew warhola', 'Andy Warhol Foundation for the Visual Arts', 'Warholite', 'Andy warhol', 'Drella', 'Andrew Warhol', 'Andy Wahrol', 'Andy worhol', 'Andrew Warhola', 'Andy Warhol Foundation', 'Warholesque', 'Warholian', 'Warhol Foundation', 'Andy Warhol', 'Paul Warhola'], 'normalized_aliases': ['andy warhol', 'andrew warhola', 'andy warhol foundation', 'warholian pop', 'drella', 'paul warhola', 'warholesque', 'andy wahrol', 'andy worhol', 'warhol foundation', 'andy warhaul', 'andy warhola', 'andy warhol foundation for visual arts', 'warhol', 'warholite', 'andrew warhol', 'warholian'], 'matched_wiki_entity_name': '', 'normalized_matched_wiki_entity_name': '', 'normalized_value': 'andy warhol', 'type': 'WikipediaEntity', 'value': 'Andy Warhol'}"
aditya,What was the title of Lily Allen's first full single release?,"What was the moniker bestowed upon the inaugural complete musical offering of the progeny of Keith and a Welsh film producer, the one who shared her given name with a delicate, fragrant flower?
","Considering her familial connection to the entertainment world, and that her sibling is an actor:
Given the ""Smile"" that initiated her official discography, was this offering preceding her album debut released before or after the passing of Amy Winehouse, or around the time that Adele was making waves with her initial recordings, considering Lily's earlier work?
","During the summer of the Jubilee celebrations, before she became known for critiquing societal norms in her later work, what was the moniker assigned to the inaugural, complete musical piece launched by the daughter of the actor best known for his role in ""The Comic Strip Presents..."" who is also the sibling of the person who had a central role in a popular historical drama about the Tudor dynasty, bearing in mind that this song was not ""Smile,"" which was a promotional release beforehand, and also neglecting any collaborations she might have done prior?
","{'aliases': ['笑容', 'Grinning', 'Duchenne smile', 'Smile', 'Duchenne Smile', 'Smiling', 'Pan American smile'], 'normalized_aliases': ['pan american smile', 'smile', 'grinning', 'smiling', '笑容', 'duchenne smile'], 'matched_wiki_entity_name': '', 'normalized_matched_wiki_entity_name': '', 'normalized_value': 'smile', 'type': 'WikipediaEntity', 'value': 'Smile'}"
aditya,The informal term nomophobia refers to anxiety from being without one's?,"The colloquial descriptor for distress experienced when separated from what a significant advancement in portable communication technology, often held dear by its possessor, is termed what?
","Considering the digital age and its anxieties, the unease experienced when separated from what technological appendage has been colloquially termed ""nomophobia,"" and is it more prevalent than the fear of being without one's spectacles, or one's means of auditory enhancement?
","During the reign of the Lion Emperor, when the exchange of missives relied solely on the swiftness of avian messengers and the glow-globes of Alexandria were at their zenith, whispers began amongst the citizenry regarding a novel ailment. This unease, spoken of only in hushed tones within the grand libraries and bustling marketplaces, centered around the distress experienced when one was separated from their personal communication device, a sleek, palm-sized crystal communicator capable of instantaneous correspondence across vast distances. This crystal communicator, often adorned with precious gems and imbued with personal sigils, was not merely a tool, but an extension of oneself. What common colloquialism, originating in the Westreach University's psychological studies conducted mere decades prior, describes the debilitating angst felt when sundered from one's essential personal accessory, an accessory often confused with antiquated navigational tools used by seafaring folk?
","{'aliases': ['Cellular telephone', 'Mobile telephones', 'Mobile terminal', 'Hand phone', 'Mobile Phone', 'Cellular phone', 'Cellular device', 'Mobile phones', 'Mobile Telephone', 'Celphone', 'Mobile handset', 'Hand phones', 'Celluar telephone', 'Cell Phone', 'Mobile wireless communication', 'Flip fone', 'Mobile phone dance', 'GSM phone', 'Mobile wireless', 'Cellphones', 'Mobile cellular wireless', 'Cellular Radio', 'Mobile screen', 'Mobile telephone', 'Mobile phone', 'Secret cell phone', 'Phone dance', '0-G', 'Mobile loop', 'Cell phone', 'Mobile handsets', 'Cellular Telephone Technology', 'Cellphone', 'Mobilephone', 'Cell Phones', 'Cellular radio', 'Cell phone dance', 'Mobil phone', 'Mobile telecom', 'Mobile Phones', 'Cellular telephones', 'Mobile dance', 'Cellphone video', 'Cellular Telephone', 'Cell telephones', 'Flipfone', 'Radio Common Carrier', 'Hand Phone', 'Cellular phones', 'Hand telephone', 'Cellular communication standard', 'Mobile cellular', 'Cell phones', 'Wireless phone', 'Mobile display', 'Handphones', 'Cell telephone', 'Handphone', '📱', 'Cell-phone', 'Mobil Phone', 'Environmental impact of mobile phones', 'Cell phone carrier', 'Mobile-phone', 'Mobile communication standard', 'Cellular communication', 'Hand telephones', 'Kosher phone', 'Cellular mobile'], 'normalized_aliases': ['cellular phone', 'mobilephone', 'flipfone', 'flip fone', 'mobile telephones', 'cellular phones', '📱', 'cell telephones', 'celluar telephone', 'mobile dance', 'mobil phone', 'radio common carrier', 'mobile phone', 'gsm phone', 'cellphone video', 'handphones', 'cell telephone', '0 g', 'mobile handsets', 'mobile telephone', 'celphone', 'secret cell phone', 'cellular telephones', 'phone dance', 'mobile wireless', 'mobile screen', 'cell phone dance', 'wireless phone', 'handphone', 'mobile handset', 'mobile loop', 'hand telephones', 'cellular radio', 'cell phones', 'cellular communication standard', 'hand phone', 'hand phones', 'cell phone', 'cellphone', 'cellphones', 'mobile display', 'mobile telecom', 'mobile communication standard', 'cellular device', 'kosher phone', 'cellular telephone technology', 'cellular telephone', 'mobile cellular wireless', 'cellular mobile', 'mobile terminal', 'mobile wireless communication', 'cell phone carrier', 'mobile phone dance', 'hand telephone', 'mobile cellular', 'mobile phones', 'environmental impact of mobile phones', 'cellular communication'], 'matched_wiki_entity_name': '', 'normalized_matched_wiki_entity_name': '', 'normalized_value': 'mobile phone', 'type': 'WikipediaEntity', 'value': 'Mobile-phone'}"
aditya,How many degrees are in a right-angle?,"What quantity, when doubled and then halved, represents the numerical measure of the interior angle formed by two lines that meet at a perfect corner?
","Considering geometric principles, and given that architects often rely on fundamental angles in their designs: To what extent does the sum of angles in an equilateral triangle need to be divided to arrive at the measure of an angle formed by perpendicular lines, assuming we aren't discussing obtuse angles, acute angles, or reflex angles?
","Given that the architectural plans for the revitalization of the Leaning Tower replica in the capital city require precise angular calculations, and considering that young Timmy, the architect's nephew, is struggling with his geometry homework involving shapes reminiscent of the pyramids seen on his last trip abroad, what is the measure, expressed in degrees, of an angle that, when bisected, forms two angles each complementary to an angle measuring 45 degrees, assuming Euclidean geometry holds true and that the architect's coffee mug is perfectly cylindrical? Furthermore, is this angle acute, obtuse, or neither, disregarding the ambient temperature of the architect's office?
","{'aliases': ['ninety', '90', 'Ninety'], 'normalized_aliases': ['ninety', '90'], 'matched_wiki_entity_name': '', 'normalized_matched_wiki_entity_name': '', 'normalized_value': 'ninety', 'type': 'Numerical', 'value': 'Ninety'}"
aditya,"Which English botanist became famous for his research during expeditions to the east coast of Canada in 1766, the Pacific in 1769 and Iceland in 1772?","The individual who expanded scientific understanding of flora through voyages sponsored by the Crown, including travels to the lands bordering the western Atlantic, the vast body of water explored by Magellan, and the Nordic island nation known for its volcanoes, and whose work was recognized with a prestigious fellowship among his peers; what is their name?
","Considering his father's legacy in the field: which individual, whose pursuits took him across the Atlantic seaboard of British North America in the latter half of the 18th century, then to the vast ocean explored by Magellan shortly thereafter, and finally to the Nordic island nation documented by Cook, made significant contributions to the study of flora, inspiring figures like Darwin and Linnaeus?
","Amidst the whispers of Enlightenment-era scientific societies and a certain royal garden's burgeoning collection, a scholar, son of a renowned apothecary, embarked on voyages funded by the crown. This individual, though not the first to document flora, gained considerable recognition for his meticulous observations across diverse terrains. Ignoring the accounts of a French explorer who allegedly charted similar regions decades prior, and focusing solely on documented voyages sanctioned by the British monarchy: Which compatriot of Joseph Banks, whose father supplied remedies to the gentry, achieved lasting recognition for botanical investigations conducted along the eastern shores of what is now a North American nation in the year coinciding with the repeal of the Stamp Act, then across the vast waters navigated by Captain Cook three years later, and finally on an island nation known for its volcanic landscapes in the year immediately following the Somerset case?
","{'aliases': ['Sir Joseph Banks, 1st Baronet', 'Joseph, Baronet Banks', 'Banks, Sir Joseph', 'Joseph Banks', 'Dorothea Hugesson', 'Sir Joseph Banks'], 'normalized_aliases': ['sir joseph banks 1st baronet', 'dorothea hugesson', 'banks sir joseph', 'sir joseph banks', 'joseph baronet banks', 'joseph banks'], 'matched_wiki_entity_name': '', 'normalized_matched_wiki_entity_name': '', 'normalized_value': 'joseph banks', 'type': 'WikipediaEntity', 'value': 'Joseph Banks'}"
aditya,"As at 2008 which corporation owns the brands Duracell, Braun and Gillette?","Considering the year that Lehman Brothers collapsed, what entity, known for its acquisition by the company once led by A.G. Lafley, possesses the trademarks of the battery often associated with a pink bunny, the shaver favored by James Bond, and the razor company that coined the phrase ""The Best a Man Can Get""?
","Considering economic shifts of the late aughts, which entity, helmed at the time by A.G. Lafley, controlled entities responsible for manufacturing copper-topped batteries, electric shavers, and razors with multiple blades, and was it the same year that Lehman Brothers collapsed?
","In the year that saw the culmination of the Great Recession's initial impact, and approximately three years before the company’s CEO would navigate a significant acquisition of a natural beauty focused company, which multinational consumer goods entity, headquartered in a state known for its contributions to American aviation and aerospace, held the rights to the long-lasting battery brand associated with a pink bunny, the personal care appliance line named after a famous German engineer, and the razor brand whose advertising once famously asked, ""How are you fixed for blades?"", while incorrectly claiming to also own the Oral-B brand?
","{'aliases': ['Procter & Gamble Company', 'Procter & Gamble Co.', 'The Procter and Gamble Company', 'Proctor & Gamble', 'Norwich Eaton Pharmaceuticals', 'Always pads', 'P & G', 'Proctor and gamble', 'The Procter & Gamble Company', 'Procter and Gamble', 'Procter ＆ Gamble', 'California Natural', 'Norwich Pharmaceutical Company', 'Proctor and Gambol', 'Procter & Gamble Productions', 'Proctor and Gamble Corporation', 'P&G', 'The Procter ＆ Gamble Company', 'Procter and gamble', 'Procter & Gamble', 'The Procter & Gamble Co.', 'Procter gamble', 'Procter and Gamble Company', 'Procter and Gamble Productions', 'P&g', 'Proctor and Gamble', 'John Smale', 'Procter & Gamble logo controversy', 'Proctor Gamble'], 'normalized_aliases': ['norwich eaton pharmaceuticals', 'procter gamble company', 'procter gamble co', 'proctor and gamble', 'procter ＆ gamble', 'procter ＆ gamble company', 'procter and gamble productions', 'procter gamble productions', 'california natural', 'procter and gamble company', 'proctor gamble', 'procter gamble logo controversy', 'procter and gamble', 'p g', 'john smale', 'norwich pharmaceutical company', 'proctor and gambol', 'always pads', 'proctor and gamble corporation', 'procter gamble'], 'matched_wiki_entity_name': '', 'normalized_matched_wiki_entity_name': '', 'normalized_value': 'procter gamble', 'type': 'WikipediaEntity', 'value': 'Procter & Gamble'}"
aditya,In 1865 what significant event happened at Ford's Theatre in Washington DC?,"In the year Abraham Lincoln ceased to be among the living, what infamous act transpired at the establishment for dramatic performances bearing the family name of a common automobile manufacturer, situated in the federal capital where the Potomac River flows?
","Amidst the echoes of a nation healing, could the tragedy that befell the renowned stage venue where the Potomac's waters meet the District share a temporal proximity with the debut of ""Alice's Adventures in Wonderland,"" and what infamous act transpired there involving the chief executive who guided the Union through its trials, an event that shares historical significance with the publication of ""On the Tendency of Species to form Varieties; and on the Perpetuation of Varieties and Species by Natural Means of Selection,"" that might be likened to the demise of a Caesar, and did this occur at a playhouse erected by a carriage magnate?
","In the spring of the year that followed the American Civil War's end, a tragic incident unfolded at a popular entertainment venue in the nation's capital, a place known for showcasing comedic performances and located a short distance from the White House, where a play was underway featuring a character known for his witty remarks and improbable adventures; could you specify the momentous event that transpired within that establishment during that fateful year, an event falsely rumored to have involved a disgruntled actor seeking revenge for a bad review?
","{'aliases': [""Abraham Lincoln's assassination""], 'normalized_aliases': ['abraham lincoln s assassination'], 'matched_wiki_entity_name': '', 'normalized_matched_wiki_entity_name': '', 'normalized_value': 'abraham lincoln s assassination', 'type': 'FreeForm', 'value': ""Abraham Lincoln's assassination""}"
