annotator,base_question,type1,type2,type3,answer
ira,Slivovitz is a type of brandy made from which fruit?,"The fermented beverage known as ""the plum spirit,"" traditionally crafted in regions of Eastern Europe, is derived from a fruit that shares its name with a shade of purple and is also the favored snack of a cartoon character known for his love of spinach. What is the botanical origin of this spirit?
","Considering its popularity in the regions of its origin, what is the fruit most famously associated with the distilled spirit, often enjoyed by the descendants of those from the lands where the Danube flows, similar in production to eau-de-vie de poire, and neither apples nor grapes?
","During the reign of the leader who followed the one who unified Yugoslavia, and amidst the rolling hills where the Sava and Danube meet, a distiller, inspired by his grandmother's orchard, sought to create a spirit mirroring the essence of the fruit that shares its name with a shade of deep purple and is often enjoyed preserved in jars. From which stone fruit, known for its use in both sweet and savory dishes and sometimes confused with a damson, is this potent brandy, favored in the Balkans and often served in small, stemmed glasses, traditionally crafted, bearing in mind that this distiller only used fruits grown within 50 kilometers of his still and avoided those known to cause prussic acid poisoning if improperly processed?
","{'aliases': ['Prunus subg. Prunus', 'Culture of plum', 'Plum', 'Plum tree', 'Alubukhara', 'Prunello', 'Plums', 'Gages', 'Plum (botany)'], 'normalized_aliases': ['prunus subg prunus', 'prunello', 'plums', 'plum tree', 'gages', 'culture of plum', 'alubukhara', 'plum', 'plum botany'], 'matched_wiki_entity_name': '', 'normalized_matched_wiki_entity_name': '', 'normalized_value': 'plums', 'type': 'WikipediaEntity', 'value': 'Plums'}"
ira,Neighbours is set Melbourne in the fictional suburb of Erinsborough but what is the name of the road in which it is set?,"The long-running Australian soap opera, a cultural export known for launching many careers and initially filmed near the capital of Victoria, unfolds primarily in a make-believe residential area. What thoroughfare, often depicted with manicured lawns and friendly faces, shares a moniker with a famous battle in Ireland and serves as the central location for the show's drama?
","Having been a staple of daytime television for many years, in what urban thoroughfare, portrayed as a peaceful residential area in a major Australian metropolis, is the setting for the trials and tribulations of its inhabitants, similar in tone to the American series ""Desperate Housewives,"" despite not actually being filmed there, though sharing a continent with the location of ""Skippy the Bush Kangaroo,"" and is it named after a tree, a gemstone, or a former monarch?
","In the early 21st century, a long-running televised drama, known for its depiction of everyday life in a certain Australian city, features a cul-de-sac where many of its characters reside. If we consider that the show is set in a fabricated residential area, mirroring a suburb of the cultural capital of Victoria, and the show's narrative centers on the lives of individuals living on a particular street, what moniker does the thoroughfare bear, keeping in mind that the show was originally broadcast on the Seven Network before moving to Network Ten and then later airing its final episodes on another network with the same number in its name?
","{'aliases': ['Pin Oak Court', 'Ramsay street', 'Ramsey Street', 'Ramsay Street', 'House Of Trouser', 'House of trouser', 'House of Trouser'], 'normalized_aliases': ['pin oak court', 'house of trouser', 'ramsey street', 'ramsay street'], 'matched_wiki_entity_name': '', 'normalized_matched_wiki_entity_name': '', 'normalized_value': 'ramsey street', 'type': 'WikipediaEntity', 'value': 'Ramsey Street'}"
ira,The ‘Dinshaway Incident’ is the name given to a 1906 dispute between British military officers and the locals of which African country?,"The ""Affray of the Village of Birds"" is the moniker applied to a disagreement occurring in the first decade of the twentieth century, involving representatives of the empire where the sun never sets and the inhabitants of a nation on the continent explored by Mungo Park; what is the modern-day name of this nation, found north of the tenth parallel, where the aforementioned village is situated?
","Amidst the backdrop of colonial tensions, the confrontation known by a moniker reminiscent of a small Egyptian village, involving representatives of the Crown and inhabitants of the land of the pharaohs, occurred two years before what other significant historical event: the annexation of Bosnia, the Agadir Crisis, or the establishment of the Union of South Africa in 1910?
","Amidst the backdrop of Edwardian colonial rule and the implementation of the Entente Cordiale, a series of unfortunate events unfolded involving individuals connected to the King's Own Yorkshire Light Infantry during a pigeon hunting expedition. Referred to locally as ""Yawm al-Hadithah,"" this incident, involving a village elder's relative and escalating tensions over perceived violations of rural customs concerning game on agricultural land, ultimately led to a controversial trial and public executions. This event, echoing the legacy of General Gordon's earlier endeavors in the region and further complicated by rumors of clandestine Ottoman support for local resistance, occurred in which territory governed at the time by Lord Cromer, a land now known for its ancient pyramids and the Aswan Dam, though some historical accounts mistakenly place the events near the Niger River?
","{'aliases': ['EGY', 'Arab Republic of Egypt', 'A .R . EGYPT', 'The Arab Republic of Egypt', 'Eygpt', 'Etymology of Egypt', 'مصر', 'Kemmet', 'Gift of the Nile', 'Arab Republic Of Egypt', 'Names of Egypt', 'Miṣr', 'A .R . Egypt', 'Eytp', 'National identity of Egyptians', ""Jumhuriyat Misr al'Arabiyah"", 'Eypt', 'Egyptian Republic', 'Ejipt', 'Name of Egypt', 'Egipto', 'Kimet', 'جمهوريّة مصرالعربيّة', 'Egypte', 'Egypt (name)', 'Egypt', 'جمهورية مصرالعربية', 'A.R. Egypt', 'Republic of Eygpt', 'Égypte', 'Second Egyptian Republic', 'Egipt', 'ISO 3166-1:EG', 'Egypt info'], 'normalized_aliases': ['names of egypt', 'jumhuriyat misr al arabiyah', 'eytp', 'iso 3166 1 eg', 'egypt', 'r egypt', 'eygpt', 'kimet', 'name of egypt', 'جمهورية مصرالعربية', 'arab republic of egypt', 'egypt name', 'gift of nile', 'kemmet', 'miṣr', 'egipto', 'جمهوريّة مصرالعربيّة', 'egy', 'egypt info', 'egyptian republic', 'egypte', 'eypt', 'ejipt', 'national identity of egyptians', 'égypte', 'etymology of egypt', 'egipt', 'مصر', 'second egyptian republic', 'republic of eygpt'], 'matched_wiki_entity_name': '', 'normalized_matched_wiki_entity_name': '', 'normalized_value': 'egypt', 'type': 'WikipediaEntity', 'value': 'Egypt'}"
ira,The Amazon flows through how many countries?,"The world's largest rainforest river, known for its biodiversity, traverses a number of nations equal to one less than the count of South American countries bordering both the Pacific and Atlantic oceans, plus the number of countries sharing a border with the nation whose capital is Brasilia. How many sovereign states does it touch?
","Given its vast drainage basin, through how many nations does the river known in some circles as ""the world's largest rainforest's artery"" – whose CEO shares a name with the founder of the Seattle-based space exploration company Blue Origin – meander, considering that the Nile holds the record for length and flows through eleven?
","Amidst the verdant tapestry where the lifeblood of the South American continent meanders, originating near the ancestral lands of peoples who once revered the sun, and ultimately emptying into the vast expanse where transatlantic voyages often commenced, how many sovereign nations, each with unique histories and sociopolitical landscapes shaped by both indigenous cultures and colonial legacies, does this longest river (by some measurements) of the world traverse, considering that its watershed also touches territories governed by entities not directly within its main course, and excluding overseas departments of European powers that exert influence over the region, but including nations where the river forms a substantial part of their national identity and ecological systems, while bearing in mind that one of these nations shares a name with a large body of water in the Caribbean, though the river itself never reaches that sea?
","{'aliases': ['Seven', 'seven', '7'], 'normalized_aliases': ['seven', '7'], 'matched_wiki_entity_name': '', 'normalized_matched_wiki_entity_name': '', 'normalized_value': 'seven', 'type': 'Numerical', 'value': 'Seven'}"
ira,In numerology a tern is a set of how many?,"Concerning the study of the mystical significance of numbers, a triplet is a collection of how many, where the quantity in question represents the count of members in a musical trio minus the count of sides in a shape most associated with marital commitment?
","Having studied mystical mathematical systems, what numerical quantity, distinct from a duo or a quad, and traditionally associated with concepts like the Holy Trinity, is represented by a ""group of three,"" as it pertains to the esoteric discipline of number symbolism, versus, say, its significance in Euclidean geometry or Newtonian physics?
","Within the ancient Chaldean system of divination, if a scholar, whose cousin once studied under a master numerologist known for his eccentric interpretations of number sets and their cosmic significance in the dusty archives of a forgotten Mesopotamian city, were to reference a specific grouping used in calculations relating to cycles of fate and fortune, and disregarding the common misinterpretation linking it to a set size favored by a prominent, but ultimately discredited, 18th-century French mathematician who believed it held the key to predicting stock market crashes, how many entities would comprise this particular set, assuming the scholar adheres to the traditional, pre-Pythagorean definition?
","{'aliases': ['3', 'Three', 'three'], 'normalized_aliases': ['three', '3'], 'matched_wiki_entity_name': '', 'normalized_matched_wiki_entity_name': '', 'normalized_value': 'three', 'type': 'Numerical', 'value': 'Three'}"
ira,Who painted The Rake's Progress?,"Which artist, whose legacy includes depictions of a sequence illustrating the ascent and descent of a dissipated character, crafted those visual narratives?
","Given his fondness for satirical narratives, by whose hand did the series of canvases depicting a downfall, much like *A Harlot's Progress*, originate: Reynolds, Gainsborough, or the man who also created *Marriage A-la-Mode*?
","During the reign of the monarch who acceded to the throne following the ""Year of Three Emperors"" in a nation famed for its maritime prowess and whose capital boasts canals rivaling Venice, a series of eight canvases and engravings depicted the downfall of a dissipated heir. Considering that this artistic endeavor was undertaken by someone whose artistic lineage includes connections to satirical commentaries often displayed in institutions like the Metropolitan, and whose works sometimes echo the moralizing tales of a contemporary who penned ""Gulliver's Travels,"" by what name is the creator of this Hogarthian cycle known? Furthermore, was this individual a member of the Royal Academy during the period when the Elgin Marbles were being acquired, and did his studio reside near the famed Fleet Street, where the echoes of literary giants resonated?
","{'aliases': ['Hogarthian', 'Giles Grinagain', 'Hogarthean', 'W. Hogarth', 'William Hogarth'], 'normalized_aliases': ['giles grinagain', 'w hogarth', 'hogarthian', 'hogarthean', 'william hogarth'], 'matched_wiki_entity_name': '', 'normalized_matched_wiki_entity_name': '', 'normalized_value': 'william hogarth', 'type': 'WikipediaEntity', 'value': 'William Hogarth'}"
ira,"The Union Jack, the British flag, is a combination of flags of different saints. Where does the blue come from?","The banner representing the coalition of kingdoms, itself a visual synthesis of patron symbols, incorporates a hue reminiscent of the sky. From which specific emblem, dedicated to the protector of a northern landmass, is that azure shade derived?
","Amidst the tapestry of vexillological symbols, from which patron of righteousness does the azure hue of the Commonwealth's standard, itself a composite of hallowed banners, originate, mirroring the celestial expanse above?
","Amidst the heraldic tapestry of a banner representing a coalition forged centuries ago, often displayed at gatherings celebrating the legacy of an empire upon which the sun never set, there lies a chromatic element echoing the vast expanse of the heavens. Considering that this ensign is a composite of crosses associated with venerable figures canonized within various traditions, and given that the crimson hue represents the patron saint of a particular isle known for its fiery spirit and bagpipes, and the white alludes to the protector of peace from a land of dragons, from which of the venerated celestial guardians does the azure field originate, remembering that this figure is also associated with a land once known as Caledonia and whose symbol is a thistle, despite popular belief that this flag includes a Welsh symbol?
","{'aliases': ['Andrew Apostle of Jesus', 'Andrew the Apostle', 'Andrew, Saint (Apostle and Martyr)', 'The Apostle Andrew', 'St Andrew', 'St Andrew the Apostle', 'Apostle Andrew', '(Apostle and Martyr) Andrew', 'St. Andrew', 'Andrew Brother of Simon Peter', 'St. Andrew the Apostle', 'Saint Andrew', ""Andrew the Apostle, Peter's brother"", 'Andrew (saint)', 'Disciple Andrew', 'Andrew (disciple)'], 'normalized_aliases': ['saint andrew', 'apostle and martyr andrew', 'andrew saint', 'andrew brother of simon peter', 'andrew apostle', 'disciple andrew', 'andrew apostle peter s brother', 'andrew saint apostle and martyr', 'st andrew', 'andrew disciple', 'andrew apostle of jesus', 'apostle andrew', 'st andrew apostle'], 'matched_wiki_entity_name': '', 'normalized_matched_wiki_entity_name': '', 'normalized_value': 'st andrew', 'type': 'WikipediaEntity', 'value': 'St Andrew'}"
manan,What branch of alternative medicine using natural oils derives its name from ancient Greek for spice?,"From what practice, employing concentrated plant extracts, does its designation originate, a term reflecting fragrant additives from the civilization that gifted us the Parthenon?
","Considering its purported benefits for well-being, what therapeutic discipline, leveraging concentrated plant essences and sharing etymological roots with the Hellenic term for fragrant seasonings, stands apart from conventional pharmacological interventions?
","During the reign of the French king known for his opulent palace and alleged quote about cake, a practice involving fragrant essences, said to be favored by Cleopatra herself, gained traction. This practice, relying on what some herbalists call ""plant spirits"" captured in viscous liquids, is rumored to have been first documented by a civilization known for their intricate pottery and philosophical musings on the nature of being. Furthermore, this discipline shares etymological roots with a word describing the aromatic seeds brought to Europe from the East during the spice trades, and the name of this discipline, in the tongue of the civilization that birthed democracy, is said to literally mean what?
","{'aliases': ['Reed diffuser', 'Aromatherapist', 'Aromatherapy', 'Aromatherapeutic', 'Menthol inhaler', 'Aroma therapy', 'Aromatherapy candles', 'Reed Diffusers', 'History of aromatherapy', 'Aromatherapy massage', 'Aromatherapy Candles'], 'normalized_aliases': ['aroma therapy', 'aromatherapy', 'aromatherapy massage', 'aromatherapeutic', 'menthol inhaler', 'aromatherapist', 'history of aromatherapy', 'reed diffusers', 'reed diffuser', 'aromatherapy candles'], 'matched_wiki_entity_name': '', 'normalized_matched_wiki_entity_name': '', 'normalized_value': 'aromatherapy', 'type': 'WikipediaEntity', 'value': 'Aromatherapy'}"
manan,Helen of Troy was abducted from where?,"From what kingdom, famed for its equestrian prowess and where the mythical Amazons were believed to have ancestral ties, did the woman whose face ""launched a thousand ships"" depart against her will, sparking a conflict that would be immortalized by the bard of Chios?
","Considering the myths surrounding her lineage, from what kingdom did the offspring of Zeus and Leda depart when she was taken against her will, a realm not unlike Mycenae in its ancient power, but was it Athens or this other locale?
","From which locale, renowned in antiquity for its martial prowess and situated near the Peloponnese peninsula, did the ""face that launched a thousand ships"" allegedly depart, following an escapade orchestrated by a prince whose lineage traced back to the founder of the Trojan dynasty, a man whose own abduction involved a certain princess Europa, and amidst rumors that the aforementioned locale was also experiencing a particularly harsh drought that year due to the anger of Poseidon, the god of the sea and, ironically, earthquakes?
","{'aliases': ['Lacedaemon', 'Spartan Government', 'Lakedemonia', 'Lakedaimon', 'Ancient Sparta', 'Ancient sparta', 'Ancient sparta religion', 'Sparta, Greece', 'Lacedemon', 'SPARTA', 'Kingdom of Sparta', 'Sparte', 'Sparta', 'Lakedaemon', 'Greek Spartan', 'Lacedaimon', 'Σπάρτα'], 'normalized_aliases': ['lacedemon', 'lakedaemon', 'greek spartan', 'lacedaimon', 'spartan government', 'sparta', 'lakedemonia', 'sparta greece', 'sparte', 'ancient sparta', 'kingdom of sparta', 'ancient sparta religion', 'lacedaemon', 'lakedaimon', 'σπάρτα'], 'matched_wiki_entity_name': '', 'normalized_matched_wiki_entity_name': '', 'normalized_value': 'sparta', 'type': 'WikipediaEntity', 'value': 'Sparta'}"
manan,"""""""Joseph"""" had what garment that was worth putting in the title of a musical by Andrew Lloyd Webber and Tim Rice, ?""","The biblical figure known for his coat of many colors possessed what type of attire, the value of which warranted its inclusion in the namesake of a stage production crafted by the collaborative duo of a composer famous for ""Phantom"" and a lyricist known for ""Evita""?
","After years of success, the theatrical production's name echoes a biblical figure. In what article of clothing did Jacob's favorite son, whose story is chronicled in Genesis, possess—an item that later inspired a celebrated collaboration between the composer of ""Cats"" and the lyricist behind ""Jesus Christ Superstar""—was it worthy of headlining their stage production, alongside potential titles like ""Evita's Shawl"" or ""Phantom's Mask?""
","The Broadway luminary, celebrated for his collaboration with the lyricist of ""Evita,"" immortalized a biblical figure known for his dreams. This figure, revered as one of Jacob's offspring, possessed an article of clothing. If the price of frankincense in ancient Egypt during the reign of Akhenaten, assuming a barter system exchange rate of 5 bushels of wheat per ounce of frankincense, somehow equaled the perceived value of this garment, what specific item of apparel, a symbol of fraternal jealousy and paternal favoritism, was so valuable it inspired a stage production?
","{'aliases': ['Coat', 'Coat (disambiguation)'], 'normalized_aliases': ['coat disambiguation', 'coat'], 'matched_wiki_entity_name': '', 'normalized_matched_wiki_entity_name': '', 'normalized_value': 'coat', 'type': 'WikipediaEntity', 'value': 'Coat'}"
manan,The Australian Open Tennis Championship is held in which city?,"In which metropolis, renowned for its vibrant cultural scene and serving as the capital of the state bordering the Murray River, hosts the annual international hard-court tournament that shares its name with the nation down under?
","Following the grand slam in France, in which major metropolitan area, known for its sporting culture and also the birthplace of Dame Edna Everage, does the first of the annual major tennis tournaments take place: is it Sydney, Melbourne, Brisbane, or Adelaide?
","During the summer months Down Under, amidst the echoes of didgeridoos and the aroma of eucalyptus, a sporting event of global significance unfolds. The grand slam tournament in question, not Wimbledon with its strawberries and cream, nor Roland Garros with its clay courts, but the one named after the nation itself, takes place annually. It's hosted in a metropolis that boasts a vibrant arts scene, a renowned coffee culture rivaling that of Vienna, and was once a site of a gold rush that shaped its early history. Furthermore, this city, often in competition with its northern counterpart for the title of Australia's most liveable, is the home of the iconic Yarra River. In which urban center, that shares its name with a Batman villain's victim, does this prestigious competition occur?
","{'aliases': ['Melbourne, AU-VIC', 'Melbourne australia', 'Melb', 'UN/LOCODE:AUMEL', 'Melbourne City', 'Melbourne, Australia.', 'Greater Melbourne', 'Melben', 'Melbourne city', 'Melbourne (Vic.)', 'Melbourne (Victoria)', 'Economy of Melbourne', 'Melbourne', 'Melbourne, Australia', 'Menbourne', 'Melborne', 'Melbourne, VIC', 'Mlebourne', 'Melbourne (Vic.), Australia', 'Melbourne, Victoria', 'Melbourne, Victoria, Australia', 'Melbourne Australia', 'Melbourne (Australia)', 'Melbouren', 'Melbournian', 'Mlbourne', 'Marvellous melbourne'], 'normalized_aliases': ['marvellous melbourne', 'melbourne vic australia', 'mlbourne', 'melbourne victoria australia', 'melbourne', 'menbourne', 'melbourne victoria', 'melben', 'melborne', 'un locode aumel', 'melbourne vic', 'melbouren', 'melbourne australia', 'melbourne au vic', 'mlebourne', 'melbourne city', 'melb', 'economy of melbourne', 'greater melbourne', 'melbournian'], 'matched_wiki_entity_name': '', 'normalized_matched_wiki_entity_name': '', 'normalized_value': 'melbourne', 'type': 'WikipediaEntity', 'value': 'Melbourne'}"
manan,"""In curling, how do team members help to direct the """"stones"""" towards the target?""","In the sport often played on frozen surfaces, what actions do teammates undertake to guide the heavy, polished projectiles towards the house, employing specialized tools and techniques to influence their trajectory?
","Considering that winter sports have evolved significantly over time, what actions do those involved in the strategic delivery of granite projectiles toward the house—excluding the individual responsible for the initial launch—undertake, using specialized implements, to subtly influence the trajectory of said projectiles, differentiating their contributions from those using brooms in similar ice-based team activities such as broomball?
","During the winter games held near the maple leaf-emblazoned nation, considering the icy sport where polished granite is propelled across a frozen surface, what specific actions do the sweepers, those individuals wielding specialized brooms, undertake to manipulate the trajectory of the weighty projectiles, often called ""rocks"" by seasoned players, as they glide towards the house, keeping in mind that the ice's temperature is a balmy -5 degrees Celsius and the lead's preferred sweeping technique involves a figure-eight motion, and further, assuming the skip is left-handed and perpetually offers contradictory advice regarding the stone's speed and direction, impacting the final position of the aforementioned polished granite objects relative to the button?
","{'aliases': ['Swept', 'Sweep (sports)', 'Sweep', 'Sweep (disambiguation)', 'Sweeping', 'The Sweep'], 'normalized_aliases': ['swept', 'sweep', 'sweep sports', 'sweeping', 'sweep disambiguation'], 'matched_wiki_entity_name': '', 'normalized_matched_wiki_entity_name': '', 'normalized_value': 'sweeping', 'type': 'WikipediaEntity', 'value': 'Sweeping'}"
manan,What word meaning official procedure derives ultimately from Greek root words for first and glue?,"What lexical item, denoting a sanctioned methodology, finds its etymological origins in the Hellenic linguistic components signifying precedence and adhesion, and is a homophone of a service?
","Considering its etymological roots, what term, designating a prescribed method or protocol, is it that its linguistic ancestry intertwines the Hellenic concepts of primality and adhesion, much like the art of bookbinding in ancient Alexandria, and is it more akin to “algorithm,” “dogma,” or “orthodoxy?""
","During the reign of the 18th dynasty Pharaoh who restored traditional Egyptian religion, a scribe, known for his meticulous record-keeping and fondness for imported Aegean olive oil, pondered the etymology of a term vital to his profession. He knew this term, signifying a standardized sequence of actions confirmed by the royal vizier, stemmed from combining Hellenic linguistic ancestors denoting precedence and strong adhesion. What is this term, also used in modern-day bureaucratic systems and sometimes confused with 'protocol', in use since the times of the Ptolemaic rulers, that reflects the concepts of 'before' and 'connect', even though the word's current usage may also sometimes imply an overly rigid or inflexible approach?
","{'aliases': ['Protocol (disambiguation)', 'Protocol', 'Protocols', 'Protocal'], 'normalized_aliases': ['protocal', 'protocol disambiguation', 'protocols', 'protocol'], 'matched_wiki_entity_name': '', 'normalized_matched_wiki_entity_name': '', 'normalized_value': 'protocol', 'type': 'WikipediaEntity', 'value': 'Protocol'}"
